Resposta;Protocolo;UG
"Prezada Senhora, Esta Agência Estadual de Meio Ambiente-CPRH transcreve, abaixo, a resposta ao Pedido de Acesso à Informação registrado sob o nº 2020106265, encaminhada pela autoridade administrativa, Sr. Paulo Camaroti: ?Informo que o site da Agência Ambiental está sendo reformulado. Por esse motivo, os dados relativos ao monitoramento ambiental ainda não foram inseridos. Portanto, para melhor atendê-la, estamos disponibilizando o acesso ao antigo portal através do link que segue para que possa ter acesso aos dados requeridos: http://www.cprh.pe.gov.br/Controle_Ambiental/monitoramento/qualidade_da_agua/bacias_hidrograficas/relatorio_bacias_hidrograficas/41786%3B63044%3B4803010202%3B0%3B0.asp .?; 2020106265; CPRH"
"Prezados Senhores, A Ouvidoria Geral do Estado transcreve abaixo a resposta ao Pedido de Acesso à Informação registrado sob o nº 2020107159, enviada pela Autoridade Administrativa, Senhora Maria Luzineide Fernandes Zaidan Gama  da Secretaria de Desenvolvimento Urbano e Habitação ? SEDUH. ? 1) 6º Termo Aditivo solicitado, em anexo. 2) Dados do gestor do contrato: nome: Felipe Luiz Fonseca dos Santos Albuquerque cargo: Coordenador de Contratos e Estudos telefone: 81-3181-3304 e-mail: felipe.luiz@seduh.pe.gov.br Atenciosamente, Luzineide Fernandes Zaidan Gama Ouvidoria-SEDUH.?; 2020107159; SEDUH"
"Informo que após consulta ao Setor de Arquivamento desta Agência Ambiental, os processos solicitados não foram localizados?.Em tempo, esclarecemos que o Setor de Arquivamento desta Agência Ambiental está sendo inventariado, o que dificulta a localização imediata de alguns processos.; 201942439; CPRH"
"I nº 052/2013, oriunda do Gabinete do Secretário Executivo de Defesa Social, datada de 11 de março de 2013?; 201941234; SDS"
"Transcrevemos abaixo resposta ao Pedido de Acesso à Informação registrado sob o nº 202036995 , enviada pela Autoridade Administrativa, Sr. Inaldo Enoque Zuzu da Secretaria de Desenvolvimento Agrário de Pernambuco - SDA-PE: ""Os dados utilizados pela Secretaria de Desenvolvimento Agrário e suas vinculadas são disponibilizados pelo IBGE e esses são acessados através de site público e acessível a todos no link a seguir: https://www.ibge.gov.br/estatiticas/economicas/agricultura-e-pecuaria.html Atenciosamente, Inaldo Enoque Zuzu Autoridade Administrativa SDA"".; 202036995; SDA"
